{
  "phase_id": "P900",
  "phase_name": "Demo",
  "verdict": "READY",
  "summary": "Fase imaginaria lista para cerrar.",
  "exit_criteria_results": [
    {
      "criterion": "Ejercicios ficticios aceptados.",
      "passed": true,
      "evidence": "Resumen sintético."
    }
  ],
  "required_actions": [],
  "blocking_questions": [],
  "archive_summary_markdown": "# Demo\n\nFase sintética completada.",
  "archive_review_markdown": "# Revisión Demo\n\nREADY sintético.",
  "next_phase_id": "P901",
  "next_phase_name": "Demo siguiente",
  "next_steps_markdown": "# Phase 901 — Demo siguiente\n\n## P901-T001 — Segundo ejercicio\n\n**Objective:** Crear otro saludo ficticio.\n\n**Acceptance criteria:**\n- Devuelve un saludo.\n\n**Allowed paths:** `src/demo.py`\n\n**Executor:** claude-sonnet-5-5 / medium — Ejercicio ficticio.\n"
}
